Id,Translated Name,Attack 1,Attack 2,Requirement,Quote,Lore,Version
10512,Éclaireurs Patrouilleurs,Épée Longue,,,,"Les Patrouilleurs de la Garde de Nuit sont réputés pour leur capacité à se fondre dans la nature afin de tendre des embuscades à leurs ennemis. De tels assauts sont encore plus dévastateurs lorsqu’ils menés par des cavaliers. Dissimuler des chevaux se révèle délicat dans la plupart des environnements, mais les Éclaireurs Patrouilleurs connaissent la forêt qui s’étend au nord du Mur mieux que quiconque. Les épais taillis, les ravines cachées et même les petites cuvettes offrent de nombreuses cachettes depuis lesquelles ils peuvent surprendre leurs adversaires.",2021-S02
10513,Lanciers de Tour Ombreuse,Lance,,,,"Le château de Tour Ombreuse se dresse à l’extrémité occidentale du Mur. Du haut de ses remparts, les Frères Noirs veillent. À l’instar de tous les membres de la Garde de Nuit, les Lanciers de Tour Ombreuse sont vêtus d’acier noirci, ainsi que de cuir noir adapté aux grands froids légendaires du Nord. Les Lanciers font d’excellents flanc-gardiens, capables de recevoir des charges ennemies, qu’elles soient de cavalerie ou d’infanterie, en leur infligeant des coups de lance avant même de se trouver à portée de leur adversaire.",2021-S03
10601,Chevaliers du Cerf,Fureur du Cerf,,,,"Les Chevaliers du Cerf constituent le coeur des unités d’élite de la Maison Baratheon. Chacun d’entre eux est d’ascendance noble et porte le célèbre casque à cornes réservé aux Sers les plus honorables. Lourdement protégés, les Chevaliers du Cerf portent des cuirasses de plaques aussi efficaces que celles des Lannister et brandissent de redoutables marteaux de guerre à deux mains, capables de broyer les os comme les armures. Même encerclés, les Chevaliers du Cerf combattent avec une fureur irréductible.",2021-S03
10602,Gardiens Baratheon,Marteau de Guerre,,,,"Même si les loyautés de la Maison Baratheon sont divisées, tous ses membres suivent le même entraînement et puisent leur force dans d’anciennes doctrines de combat qui avaient cours à l’époque où la Maison était unie, avant la Guerre des Cinq Rois. Les Gardiens Baratheon portent de lourdes armures de plaques, de grands boucliers, ainsi que les célèbres marteaux de guerre des Baratheon. Résolus et robustes, les Gardiens se montrent aussi efficaces à l’avant-garde qu’au centre, bien que la vitesse ne soit pas leur fort.",2021
10603,Sentinelles Baratheon,Doubles Marteaux,,,,"Bien qu’officiellement classées en infanterie moyenne, les Sentinelles Baratheon sont équipées d’une armure plus lourde que celles généralement portées par des unités chargées de mener ou de contrer des manœuvres de flanc. Leur mobilité s’en trouve évidemment réduite, mais, contrairement à la plupart des unités d’infanterie moyenne, elles tiennent remarquablement bien leurs positions et portent des assauts dévastateurs. Le marteau de guerre se révèle délicat à manier pour quiconque ne possède pas l’entraînement adéquat, mais, entre les mains des Sentinelles, nulle armure ne résiste à sa frappe destructrice",2021-S03
10604,Chevaliers de la Rose,Épée Longue,,"Loyauté : **RENLY BARATHEON**
*Dans votre armée, vous ne pouvez recruter ni d’unité ni d’Attachement avec une loyauté différente.*",,"En tant qu’unités de première ligne au service du roi Renly, les Chevaliers de la Rose, vêtus d’un vert éclatant, sont lourdement armés et équipés. Grâce aux coffres pleins de Renly, ils ont accès aux meilleures armures qui soient. Un entraînement intensif et une loyauté farouche envers leur roi permettent à ces troupes de faire front sans faillir, même en cas de blessures graves. Un général avisé doit cependant veiller à ce que les Chevaliers de la Rose ne se retrouvent pas encerclés, bien qu’ils soient capables d’encaisser les assauts les plus violents et de riposter deux fois plus fort.",2021-S03
10605,Fidèles de R'hllor,Lame de la Foi,,"Loyauté : **STANNIS BARATHEON**
*Dans votre armée, vous ne pouvez recruter ni d’unité ni d’Attachement avec une loyauté différente.*",,"Bien que personne ne puisse remettre leur foi inébranlable en R’hllor en question, les soldats de Stannis connus sous le nom de Fidèles ne possèdent pas chacun leur propre Illumination, la légendaire épée flamboyante d’Azor Ahai. Au lieu de cela, leurs lames sont enflammées par un mélange d’huiles qui produisent une forte chaleur pendant une courte période. S’ils ne sont pas lourdement protégés, leur conviction zélée leur permet de tenir tête à n’importe quel ennemi et garantit que même s’ils tombent au combat, ils inspireront ceux qui les entourent.",S04
10606,Champions du Cerf,Colère du Champion,,,,"Conformément à la doctrine Baratheon qui préconise de porter des armes lourdes et des armures qui le sont plus encore, les Champions du Cerf sont équipés d’ensembles de plates complètes et montés sur de formidables destriers. Ces colosses disposent de toute la mobilité qu’offre la cavalerie, alliée à la trempe des unités de première ligne. Les généraux avisés sauront profiter de cette mobilité afin que les Champions puissent engager les unités de leur choix, mais si le besoin s’en fait sentir, ces chevaliers sont capables de tenir la ligne de front bien plus longtemps que la plupart des autres unités de cavalerie.",2021-S02
10607,Noble de Peyredragon,Colère Noble,,"Loyauté : **STANNIS BARATHEON**
*Dans votre armée, vous ne pouvez recruter ni d’unité ni d’Attachement avec une loyauté différente.
Votre armée peut inclure un maximum de 2 Nobles de Peyredragon.*",,"Les Nobles de Peyredragon sont aisément reconnaissables grâce aux bois de cerf, l’emblème de la Maison Baratheon, qui ornent leurs casques. Vêtus de la tête aux pieds d’armures de plates et fonçant au combat sur leurs montures lourdement caparaçonnées, les Nobles de Peyredragon font partie des guerriers les plus résistants que l’on puisse rencontrer sur un champ de bataille. Plus la situation est désespérée, plus ces fanatiques combattent farouchement. Bien qu’ils excellent à immobiliser des troupes plus légères, il est important de veiller à ce qu’ils ne se retrouvent pas encerclés.",S04
10608,Hommes du Roi,Lame du Roi,,"Loyauté : **STANNIS BARATHEON**
*Dans votre armée, vous ne pouvez recruter ni d’unité ni d’Attachement avec une loyauté différente.*",,"À la cour de Stannis Baratheon, les Hommes du Roi font partie de ceux qui restent fidèles aux Sept, la religion la plus répandue dans tout Westeros. S’ils ne partagent pas les convictions des Hommes de la Reine qui vénèrent R’hllor, ils ne sont pas non plus leurs ennemis, bien que les deux groupes aient des méthodes d’entraînement différentes. Les Hommes du Roi se spécialisent dans l’utilisation de l'épée à deux mains, en essayant de rester aussi mobiles que le permettent leurs armures lourdes. Ils se démarquent également par leur loyauté indéfectible envers le seul roi véritable, Stannis Baratheon.",S04
10609,Hommes de la Reine de R'hllor,Épée Longue,,"Loyauté : **STANNIS BARATHEON**
*Dans votre armée, vous ne pouvez recruter ni d’unité ni d’Attachement avec une loyauté différente.*",,"Les Hommes de la Reine de la cour de Stannis Baratheon ne doivent pas tant leur titre à leur dévouement envers la reine Selyse qu’à leur conversion à la foi de R’hllor (certains vont jusqu’à prétendre que leur véritable allégeance va à Mélisandre, la Prêtresse Rouge). Les Hommes de la Reine constituent une unité d’élite de première ligne, lourdement équipée pour soutenir des assauts de n’importe quel adversaire. Bien qu’ils souffrent de la lenteur inhérente aux troupes lourdes, les Hommes de la Reine font preuve d’une incroyable résistance.",S04
10610,Illuminés de R'hllor,Flèches Enflammées,Dagues,"Loyauté : **STANNIS BARATHEON**
*Dans votre armée, vous ne pouvez recruter ni d’unité ni d’Attachement avec une loyauté différente.*",,"Perpétuant la tradition Baratheon des armures lourdes, les Illuminés de R’hllor sont équipés de cottes d’écailles et de casque de plates, ce qui leur permet d’encaisser les assauts ennemis beaucoup plus efficacement que la plupart des archers. Grâce à cette protection supplémentaire, ils peuvent mettre en valeur leur meilleur atout : le feu. Les flèches des Illuminés sont enduites d’huile et allumées juste avant le tir. L’huile est particulièrement collante et, même si elle se consume rapidement, elle peut facilement mettre le feu aux matériaux touchés.",2021-S01
10611,Garde des Épines,Arbalète du Gardien,Épée Longue,"Loyauté : **RENLY BARATHEON**
*Dans votre armée, vous ne pouvez recruter ni d’unité ni d’Attachement avec une loyauté différente.*",,"Les arbalétriers de la Garde des Épines sont équipés de mailles renforcées de plaques, d’épées longues au lieu des poignards ou lames courtes que portent habituellement les archers, et d’arbalètes exceptionnelles. En effet, ils sont bien plus entraînés au combat en mêlée que la plupart des archers. Cela dit, l’arbalète reste leur arme principale, capable de perforer de lourdes armures, et les généraux avisés sauront les employer de manière appropriée.",2021-S03
10612,Cavaliers de Hautjardin,Lance,,"Loyauté : **RENLY BARATHEON**
*Dans votre armée, vous ne pouvez recruter ni d’unité ni d’Attachement avec une loyauté différente.*",,"House Tyrell is steeped in chivalric traditions, and King Renly’s alliance to them by way of Lady Margaery has earned the loyalty of the famed Riders of Highgarden. While not as heavily armored as most cavalry, the Riders can mount a charge as devastating as anything other factions can muster. A commander should guard against allowing them to be bogged down in a protracted melee, but even then, their loyalty and bravery shine through.",2021-S01
10613,Piquiers de Hautjardin,Piques,,"Loyauté : **RENLY BARATHEON**
*Dans votre armée, vous ne pouvez recruter ni d’unité ni d’Attachement avec une loyauté différente.*",,"La Maison Tyrell est bien ancrée dans les traditions chevaleresques, et l’alliance du Roi Renly avec la famille de Lady Margaery a permis de gagner la loyauté des célèbres Cavaliers de Hautjardin. Bien qu’ils ne soient pas aussi caparaçonnés que les autres troupes à cheval, les Cavaliers de Hautjardin peuvent déclencher une charge tout aussi dévastatrice que celles des autres factions. Un général avisé devra se garder de les laisser s’enliser en mêlée. Néanmoins, même en de telles circonstances, ils feront preuve d’une loyauté et d’une bravoure sans faille.",2021-S03
10614,Garde Arc-en-Ciel,Lames de Maître,,"*Ne peut être recrutée que dans une armée qui comprend Renly Baratheon, Roi du Sud. Renly doit être attaché à cette unité. Vous ne pouvez pas inclure Loras Tyrel. Vous ne pouvez pas inclure Brienne.*",,"La Garde Arc-en-Ciel du Roi Renly Baratheon réunit ses plus redoutables et fidèles lieutenants. Ces chevaliers sont au service du cadet des Baratheon et lui ont prêté allégeance. Lorsqu’ils se rassemblent sur le champ de bataille, ils constituent le noyau dur des forces de Renly, capables de tenir la ligne de front comme de prendre de flanc les ennemis à découvert. Mais le plus important est peut-être qu’ils incarnent l’espoir et la foi envers la cause du Roi Renly, ainsi que son ambition d’unifier tout Westeros sous sa bannière.",S04
10615,Hallebardiers Baratheon,Hallebarde,,,,"Quiconque affronte la Maison Baratheon se retrouve face à un dilemme. Elle dispose de troupes résolues dotées de solides armures, et le soutien des Hallebardiers compense la faiblesse inhérente de l’infanterie lourde face à la cavalerie. De plus, toute hésitation ou manque d’engagement de la part d’une unité de cavalerie (ou d’une force similaire) entraîne une confusion facilement exploitable. Tout commandant compétent de la Maison Baratheon saura trouver de multiples avantages à l’utilisation d’Hallebardiers dans ses rangs.",2021
10701,Hurleurs Dothraki,Arakh Dothraki,,,,"Il est tentant de considérer les Dothraki comme une bande de barbares hurlants et sans cervelle, car pour un oeil non averti, c’est exactement ce qu’évoquent leurs tactiques de combat. Un khalasar Dothraki peut réunir plusieurs milliers d’hommes et chacun d’entre eux a passé plus de temps sur sa selle que sur ses deux jambes. Bien que les Dothraki ne soient que légèrement protégés, leur habileté à cheval est telle qu’il est difficile de leur assener un coup d’épée, même lorsqu’ils sont engagés dans un corps à corps.",2021-S03
10702,Cavaliers Dothraki,Arc de Cavalerie,Lame de Cavalerie,,,"Peu d’éclaireurs sont capables de rivaliser avec les Cavaliers Dothraki sur leur propre terrain, mais c’est lorsque la bataille a commencé qu’ils révèlent toute leur valeur : celle d’une unité de tir mobile. Là où la plupart des archers classiques s’en prennent à l’infanterie adverse, les Cavaliers Dothraki sont capables de décocher une volée de flèches, puis de se mettre hors de portée de l’ennemi. Seuls d’autres archers ou des cavaliers légers peuvent espérer les contrer. En conséquence, les cavaliers Dothraki doivent à tout prix rester mobiles.",2021-S03
10703,Vétérans Dothraki,Arc Court,Arakh Dothraki,,,"Les Vétérans constituent l’élite de la cavalerie Dothraki. Aussi à l’aise à l’épée qu’à l’arc, les Vétérans affaiblissent leurs proies avec leurs flèches avant de les charger férocement, découpant leurs ennemis à grands moulinets de leurs arakhs tranchants comme des rasoirs. Tous les Dothraki sont des cavaliers hors pair, mais la maîtrise des Vétérans est tout simplement inimaginable, l’homme et la monture se déplaçant avec une précision parfaite, même au cœur du plus sanglant des corps à corps.",S04
10704,"Jorah Mormont, le Chevalier Errant",Épée Longue,,,« Les spectres ne sont pas plus nombreux ici qu’ailleurs. Nous les emmenons partout avec nous. »,"Quoi que l’on puisse penser des agissements et du passé trouble de Jorah Mormont, ses prouesses martiales lui ont permis de gagner le respect des Dothraki, ce qui est loin d’être une mince affaire. Vétéran de nombreuses batailles devenu mercenaire, Jorah possède un œil aguerri pour déceler les failles dans les rangs ennemis et permettre à ses troupes de les exploiter. Ser Jorah préfère combattre à cheval et ses talents de cavalier surpassent ceux de la plupart des Ouestriens.",2021-S03
10705,Maîtres d'Armes Immaculés,Prouesse Immaculée,,,,"Chez les célèbres Immaculés, seule une recrue sur trois survit au brutal processus d’entraînement. Ces redoutables légions d’eunuques sont réputées pour leurs talents martiaux et leur discipline inflexible. Même si individuellement, ils ne sont pas forcément de taille face aux soldats Ouestriens, les Immaculés ne ressentent aucune douleur et sont capables de frapper l’ennemi lorsque celui-ci s’y attend le moins. Malheur à celui qui fera l’erreur de les sous-estimer à cause de leur frêle stature et leurs coutumes étranges.",2021-S01
10706,Piquiers Immaculés,Pique de Phalange,,,,"Bien que, selon les standards Ouestriens, les Piquiers Immaculés soient assimilés à de l’infanterie légère, ces guerriers combattent en formation serrée en suivant les doctrines établies par l’Ancien Empire de Ghiscari. Face à une charge de cavalerie, une phalange d’Immaculés, boucliers dressés, représente un rempart pratiquement infranchissable. Les troupes d’infanterie légère ont également du mal à franchir leur mur de piques. Même s’il est difficile de prendre cette unité par surprise, un général avisé veillera cependant à ce qu’elle ne soit pas encerclée.",2021
10707,Drogon,Feu Noir,,*Ne peut être recruté que dans une armée qui comprend Daenerys Targaryen.*,,"Drogon doit son nom à Khal Drogo, l’époux défunt de Daenerys Targaryen. Ses écailles sont d’un noir profond, tandis que sa crête et ses cornes sont rouge sang. Ses yeux sont décrits comme étant des « fosses rouges et embrasées ». Bien que Drogon soit loin d’être adulte, sa taille actuelle et son caractère en font l’une des créatures les plus redoutables au monde. Doté d’une mobilité sans pareille et de la capacité de cracher le feu, Drogon est capable de se rendre où bon lui semble sur le champ de bataille et d’y tuer n’importe qui.",2021-S02
10708,Viserion,Feu Doré,,*Ne peut être recruté que dans une armée qui comprend Daenerys Targaryen.*,,"Viserion doit son nom à Viserys, le frère de Daenerys Targaryen. On l’appelle souvent de dragon blanc, bien qu’il soit plutôt couleur crème avec une crête et des cornes dorées. Ses griffes et ses dents sont d’un noir brillant, tandis que ces yeux sont des « lacs d’or fondu ». Bien que Viserion soit loin d’être adulte, sa taille actuelle en fait l’une des créatures les plus redoutables au monde. Doté d’une mobilité sans pareille et de la capacité de cracher le feu, Viserion est capable de se rendre où bon lui semble sur le champ de bataille et d’y tuer n’importe qui.",2021-S02
10709,Rhaegal,Feu de Jade,,*Ne peut être recruté que dans une armée qui comprend Daenerys Targaryen.*,,"Rhaegal doit son nom à Rhaegar, le frère de Daenerys Targaryen. Il est d’un vert et d’un bronze majestueux, avec des crocs et des griffes noir de jais. Ses yeux « plus brillants que des boucliers polis, luisent de leur propre chaleur ». Bien que Rhaegal soit loin d’être adulte, sa taille actuelle en fait l’une des créatures les plus redoutables au monde. Doté d’une mobilité sans pareille et de la capacité de cracher le feu, Rhaegal est capable de se rendre où bon lui semble sur le champ de bataille et d’y tuer n’importe qui.",2021-S02
10710,Hrakkars Dothraki,Griffes et Lames,,Limité : *Votre armée peut inclure un maximum de 2 Hrakkars Dothraki.*,,"Dresser l’un des grands lions blancs de la Mer Dothraki est un exploit dont les seuls les plus grands khalasars peuvent se targuer. Ces fauves redoutables jouissent d’un statut aussi prestigieux que celui des célèbres Loups-garous des Stark et leur présence sur le champ de bataille est tout aussi impressionnante. Rapides, mortels et par-dessus tout discrets, les Hrakkars en chasse peuvent fondre à tout moment sur les troupes imprudentes qui affrontent les Dothraki.",S04
10711,Derviches Corbeaux Tornade,Frappe Éclair,,,,"Payez à un Derviche Corbeau Tornade une semaine de solde, et vous aurez à votre disposition tirailleur aguerri et endurci, apte à se déplacer rapidement en armure moyenne afin de frapper les positions ennemies les plus exposées. Les Corbeaux Tornade sont connus pour n’être fidèles qu’à l’argent et cette sinistre réputation s’étend jusqu’à leurs soldats les mieux entraînés. Pourtant, les employeurs qui voient les derviches en action ont rarement des raisons de se plaindre, car ces guerriers redoutables sont capables de mettre en pièces les flancs ennemis avant de se replier en toute sécurité, annihilant toute velléité de contre-attaque.",S04
10712,Archers Corbeaux Tornade,Arc Long de Mercenaire,Épée Courte,,,"Que ce soit avec une lame, un arc ou les deux, un Corbeau Tornade reste un Corbeau Tornade. Il n’est motivé que par l’argent et une petite rallonge peut suffire à lui faire accomplir des miracles. Avec leurs arcs longs recourbés et leurs flèches à longue portée, les Archers Corbeaux Tornade sont des spécialistes du combat à distance. Ils ne brillent pas au corps à corps, même si leurs épées courtes peuvent occasionnellement leur permettre de repousser un assaillant affaibli. Un général avisé saura les tenir éloignés de la cavalerie ou de troupes débordant par le flanc.",S04
10713,Mercenaires Corbeaux Tornade,Épée Longue,,Réactivité : *Réduisez le coût de 1 Attachement de cette unité de 1.*,,"Bien que les Corbeaux Tornade ne soient pas toujours loyaux envers leurs chefs, leurs employeurs, voire envers eux-mêmes, leur dévouement absolu à l’argent est indiscutable. Lorsqu’on y met le prix, les Mercenaires Corbeaux Tornade se révèlent être une infanterie moyenne efficace, et sont capables de tenir une aile ou d’effectuer eux-mêmes des manœuvres de flanc. Tant que l’argent coule à flots, leur employeur, quel qu’il soit, peut compter sur leur professionnalisme sans faille.",S04
10714,Affranchis,Armes Improvisées,,,,"Lorsque Daenerys Targaryen fit la conquête d’Essos, elle libéra des dizaines de milliers d’esclaves. Sans qu’elle cherche vraiment à les recruter, ces hommes et ces femmes libérés du joug de l’esclavage prirent les armes pour rejoindre ses rangs. Les affranchis s’équipent de tout ce qui leur tombe sous la main : armes de récupération, pioches, faux, voire simples massues et, s’ils sont nombreux, ils manquent cruellement d’entraînement et de discipline. Ils ont la force du nombre, mais on ne peut guère compter sur eux pour tenir la ligne de front.",S04
10715,Sang-Coureurs de Drogo,Arakh Dothraki,,*Ne peuvent être recrutés que dans une armée qui contient Khal Drogo. Il doit être attaché à cette unité.*,,"Les Sang-coureurs Dothraki d’Essos offrent leur vie et leur sang à leur khal afin de devenir ses compagnons, gardes du corps et lieutenants. Le serment des Sang-coureurs est inviolable et ils sont prêts à suivre à leur seigneur jusque dans la mort.  Qu’ils chevauchent aux côtés de Khal Drogo ou qu’ils mènent leurs propres troupes, Cohollo, Haggo et Qotho sont tous des combattants hors pair capables d’affronter un ennemi dix fois supérieur en nombre.",S04
10716,Bêtes d'Airain,Armement Disparate,,,,"Instaurées par Daenerys Targaryen, les Bêtes d’airain sillonnent les rues de Meereen, l’une des majestueuses Cités des Esclavagistes. Leur nom provient des masques de bronze qu’ils arborent, moulés en têtes de chacal, de crocodiles ou d’ours. Leur création a permis d’alléger le fardeau des Immaculés, qui étaient souvent la cible d’assassinats lors de leurs patrouilles. Les Bêtes ne connaissent pas la peur. Elles foncent sur leurs ennemis dans les rues étroites pour les anéantir au corps à corps.",2021-S03
10717,Gladiateurs,Armement d'Arènaire,,,,"Les combats de gladiateurs constituent l’une des formes de divertissement les plus populaires (et les plus dangereuses). Les combattants asservis doivent être rompus à tous les styles de combat et être parés à toute éventualité, et ce en dépit de leur manque d’entrainement et de leur armement hétéroclite. Les Gladiateurs ont prêté allégeance à Daenerys quand celle-ci les a affranchis. Les généraux adverses auraient tort de sous-estimer ces guerriers peu conventionnels, même s’ils semblent manquer d’expérience sur le champ de bataille.",2021
10801,Ravageurs Fer-nés,Haches de Ravageur,,,,"Le long de la côte, les actes de piraterie et de pillage perpétrés par les Ravageurs Fer-nés leur ont conféré une sinistre réputation. Dès qu’ils apparaissent à l’horizon, leurs drakkars répandent la terreur parmi la population. Bien qu’ils soient tous des marins chevronnés, les Fer-nés portent néanmoins une cotte d’écailles légère, même lorsqu’ils sont à bord. Redoutables en tant que troupes d’attaque rapide, ils ne sont toutefois pas entraînés à soutenir un assaut prolongé. Un général avisé saura les tenir éloignés de la ligne de front.",2021-S03
10802,Archers Fer-nés,Flèches de Fer-Nés,Épée Courte,,,"Issus d’un peuple marin, les Fer-nés ne craignent pas la noyade et leurs cottes d’écailles légères leur confèrent une excellente protection sans pour autant entraver leurs mouvements. Leurs Archers, souvent venus des rangs des Ravageurs, sont de meilleurs combattants au corps à corps que la plupart des unités de tir. Les Archers ne sont toutefois pas des troupes de contact et ils doivent être protégés contre les assauts directs.",2021-S03
10803,Faucheurs de la Maison Harloi,Ferveur du Faucheur,,,,"La faux est généralement considérée comme peu efficace en tant qu’arme de guerre, mais les redoutables Faucheurs de la Maison Harloi utilisent un modèle de bardiche à lame longue qui évoque le symbole de leur famille. Les Faucheurs sont des troupes légères réputées pour leur extrême férocité. À quoi bon porter une armure lorsque l’ennemi est paralysé de terreur ? Lorsqu’il s’agit de répandre la peur dans les rangs ennemis, peu d’unités sont capables de rivaliser avec les Faucheurs.",S04
10804,Foregefers,Grand Marteau,,,,"Les troupes lourdement cuirassées de la Maison Forgefer sont souvent placées au centre des forces Fer-nées, notamment lorsqu’une ligne de défense est nécessaire. Grâce à leur armure d’écailles recouvrant d’épais vêtements de cuir bouilli, les Forgefers sont bien plus aptes à résister aux assauts que la plupart des troupes des Îles de Fer. Toutefois, comparés à d’autres « unités lourdes », les Forgefers font plutôt office d’infanterie moyenne, tout au moins tant qu’ils n’ont pas mis la main sur leur part du butin !",2021-S03
