Id,Translated Name,Attack 1,Attack 2,Requirement,Quote,Lore,Version
10805,Trappeurs Fer-nés,Piques Barbelées,,,,"Dans la Guerre des Cinq Rois, le pillage et les raids constituent la principale motivation des Fers-nés.   Que les grandes Maisons s’affrontent pour le Trône de Fer si elles le souhaitent. Les Fer-nés, eux, ont des côtes à piller, du butin à récolter et des gens à asservir. À ce titre, les Trappeurs Fer-nés n’ont pas leur pareil pour entraver leurs ennemis à l’aide de leurs longues piques barbelées et de leurs filets. Grâce à leur ruse et à l’utilisation ingénieuse d’outils déloyaux, les trappeurs parviennent à compenser leur manque de protection et leurs armes rudimentaires.",S04
10806,Élus des Noirmarées,Hache de Maître,,,,"De toutes les troupes que la Maison Greyjoy envoie harceler les villages côtiers, nulle n’inspire plus de terreur que les Élus des Noirmarées. Dès qu’ils débarquent, ces guerriers chevronnés se mettent rapidement en formation et annihilent toute fortification et tout défenseur qui se dressent sur leur chemin. Vêtus de pied en cap de lourdes cottes de mailles et armés de haches forgées par les meilleurs maîtres-artisans, les Élus font partie des troupes les plus solides qui combattent sous la bannière de la Seiche.",S04
10807,Hommes du Silence,Grande Hache,,,,"Ceux qui naviguent sous la bannière de la Seiche ont compris depuis longtemps que le pillage et la terreur vont de pair.  C’est pour cette raison que l’équipage du Silence, le navire amiral de la Maison Greyjoy, est composé entièrement de muets. La guerre est généralement une affaire bruyante, cependant les Hommes du Silence font planer un mutisme surnaturel sur le champ de bataille. Même dans la mort, ils ne profèrent jamais le moindre son, ce qui a pour effet de déstabiliser les troupes les plus endurcies.  Bien qu’ils ne soient équipés que d’armures légères, leurs grandes haches acérées sont capables d’enfoncer la plus solide des armures.",S04
10808,Les Noyés,Gourdin,,,,"Uniquement protégés par leur foi, et armés de gourdins en bois flotté ou d’autres détritus glanés sur le rivage, les Noyés apportent un soutien étonnamment efficace à ceux qui combattent sous la bannière de la Seiche. Leur présence sur le champ de bataille est le signe de la bénédiction du Dieu Noyé, encourageant les hommes à faire fi de leurs blessures et à combattre avec un acharnement renouvelé. Bien qu’ils soient peu nombreux, les Noyés puisent une telle force dans leur foi qu’ils sont capables de résister à des coups mortels.",S04
10809,Pillards des Roches,Harpon,,,,"L’apparition du pavillon de la Seiche à l’horizon est généralement synonyme d’ennuis pour les habitants des Roches, en grande partie à cause des Pillards embarqués à bord de ces navires. Ces soudards sont capables de se mouvoir avec rapidité et de s’emparer de tout ce qui passe à leur portée en massacrant ou mettant en déroute quiconque se dresse sur leur chemin. Cet élan meurtrier leur permet de soutenir des combats plus longtemps que la plupart des troupes dotées d’un équipement équivalent, mais à face à un adversaire plus coriace, ils auront besoin de soutien. ",2021
10901,Lanciers Martell,Lance,,,,"Certaines grandes maisons engagées dans la Guerre des Cinq Rois investissent dans des armures lourdes. La Maison Martell privilégie davantage l’art de la mobilité et de l’appui tactique. Les Lanciers Martell portent l’armure légère par-dessus leur tunique du désert, ce qui leur permet de conserver une excellente agilité au combat mais aussi de résister à l’aridité du climat dornien. Leurs lances traditionnelles peuvent stopper net une charge ennemie et leur programme de formation accélérée permet aux Martell de constituer rapidement l’ossature principale de leur armée.",2021
10902,Tirailleurs des Sables,Arc de Tirailleur,Lame de Tirailleur,,,"Au combat, l’agilité des Tirailleurs des Sables de la Maison Martell s’apparente à une véritable danse mortelle de lames et de flèches. Dotés d’une armure légère, ils sont bien plus mobiles que les plus rapides de leurs adversaires. Leur entraînement leur permet de harceler l’ennemi tout en le maintenant sous une pluie de flèches.  S’ils se retrouvent acculés en mêlée, les Tirailleurs des Sables sauront se défendre comme toute unité légère, mais un général avisé leur enverra des renforts dès que possible.",2021
10903,Derviches de Lancehélion,Lames de Derviche,,,,"Les Derviches de Lancehélion ont érigé la doctrine de mobilité au combat chère à la Maison Martell en un art raffiné. Leur entraînement leur permet d’engager le combat avec fulgurance, de frapper fort puis de se désengager rapidement afin de se repositionner ou de choisir une cible plus opportune.  La danse mortelle de leurs lames tournoyantes a généralement pour effet de déstabiliser l’adversaire au point de limiter ses possibilités de riposte. Même si les Derviches savent tenir la mêlée, il est préférable de toujours les garder en mouvement.",2021
10904,Garde Royale de Lancehélion,Lance Royale,,,,"Les célèbres Gardes Royaux de la maison Martell sont peu nombreux, mais comptent parmi les unités les mieux entraînées de tout Westeros. Leurs techniques de combat les rendent efficaces aussi bien en attaque qu’en défense. Les gardes disposent d’une condition physique qui leur permet de conserver leur mobilité malgré leurs armures, plus lourdes que celles des autres unités Martell. Lorsqu’il s’agit de tenir le centre de l’avant-garde, la Garde Royale de Lancehélion reste sans égal au sein des forces Martell.",2021
10905,Vipères des Dunes,Lance et Filet,,,,"Le paysage dornien évoque une mer de dunes sans fin. Il est facile d’être pris au piège de ses sables mouvants. Néanmoins, cette terre est celle des Vipères des Dunes, qui connaissent chacun de ses grains de sable. Grâce à leur connaissance du terrain, elles excellent dans les tactiques de guérilla. Elles harcèlent l’ennemi, les enserrant dans leurs filets avant de les embrocher de leurs lances. Les Vipères des Dunes donnent leur plein potentiel lorsqu’elles sont associées à une autre unité, mais elles sont capables de se débrouiller seules en cas de besoin.",2021
10906,Éclaireurs des Météores,Cimeterre,,,,"La Maison Dayne est la plus puissante vassale de Dorne. Son siège se situe dans la forteresse des Météores. Les Dayne sont connus pour leurs talents équestres et forment une partie non négligeable des forces montées de la Maison Martell. Les Éclaireurs des Météores sont des cavaliers légers dont la fonction consiste à harceler l’ennemi et à soutenir les unités alliées à proximité. Sous le soleil de plomb du désert, l’arrivée de ces troupes en tuniques violettes constitue un symbole fort pour les amis de la Maison Martell.",2021
10907,Chevaliers des Météores,Lance des Météores,,,,"L’environnement joue un rôle capital dans l’équipement et l’entraînement d’une armée. Sous le soleil brûlant de Dorne, les Chevaliers des Météores de la Maison Dayne, vassaux de la Maison Martell, portent des armures plus légères que la plupart des cavaliers lourds. Ils compensent leur protection moindre par leur vitesse et leur mobilité, ce qui leur permet de fondre sur l’ennemi là où il s’y attend le moins, et de causer des ravages avec leurs lances lors des charges.",2021
10908,Escorte de Sombre Astre,Cimeterre,,,,"La garde personnelle de Ser Gerold Dayne ne porte aucun nom officiel. Elle est simplement connue sous le nom d’Escorte de Sombre Astre, une appellation bien suffisante pour semer la terreur dans les rangs adverses. En effet, l’Escorte est composée de soldats qui marchent dans les pas de Sombre Astre, tant dans leur comportement que dans leur style de combat. Ils semblent surgir de nulle part, fondant généralement sur un flanc mal protégé, puis disparaissent jusqu’à ce qu’une nouvelle ouverture se présente. Pour autant qu’ils aient laissé des survivants, bien entendu.",2021
11001,Coupe-Jarrets,Agression Impitoyable,,,,"Malgré leur équipement léger, les Coupe-Jarrets de la Maison Bolton jouissent d’une réputation de brutalité et d’efficacité impitoyable qui leur permet de répandre la peur dans les rangs de troupes ennemies bien mieux équipées. Leurs masses à pointes peuvent broyer leurs ennemis, mais c’est en tant qu’instruments de terreur qu’elles se révèlent les plus utiles. Les Coupe-Jarrets de la Maison Bolton se plaisent à humilier leurs ennemis vaincus ou, pire encore, à les capturer pour leur faire subir un sort plus terrible encore",2021-S01
11002,Gardes Noirs,Fléau à Pointes,,,,Tous les adversaires des Gardes Noirs de la Maison Bolton ont eu vent de leur cruauté. Leurs terribles fléaux à pointes peuvent défoncer les boucliers les plus solides. Les Gardes Noirs constituent les troupes les plus lourdes des forces de la Maison Bolton et sont donc capables de prendre et de tenir n’importe quelle position sur le champ de bataille.,2021
11003,Archers de Fort Terreur,Volée Impitoyable,Épée Courte,,,"Lorsqu’on parle des pires horreurs de guerre, autant destinées à répandre la terreur qu’à causer des pertes, impossible de ne pas évoquer la Maison Bolton. Les Archers de Fort Terreur font pleuvoir sans retenue de cruelles volées de flèches sur leurs adversaires, sans la moindre considération pour leurs camarades engagés dans la mêlée. Les troupes alliées auront sans doute à déplorer quelques pertes, mais le mépris de toute vie qu’affiche la Maison Bolton ne s’applique pas qu’à leurs ennemis.",2021
11004,Filles du Bâtard,Arc de Pisteur,Lames et Crocs,,,"Dressées à acculer et à abattre la plus lourde des infanteries, les Filles du Bâtard excellent dans les attaques de flanc et dans la traque d’adversaires en fuite. Bien qu’elles ne soient pas assez protégées pour soutenir un assaut prolongé, elles se complaisent à fondre sur les ennemis blessés par les flèches de leurs maîtres. Une forte récompense attend le dresseur qui aura su capturer un officier ennemi afin que Ramsay Bolton puisse « se divertir » après la bataille.",2021
11005,Écorchés,Fléau de Guerre,,,,"Dans la Guerre des Cinq Rois, ceux que l’on nomme les Écorchés forment les rangs d’une cavalerie plus lourde que la plupart de celles combattant sous des bannières pourtant plus prestigieuses. Équipés de robustes armures d’acier (noirci, bien évidemment), de grands boucliers et de lourdes bardes pour leurs chevaux, les Écorchés peuvent effectuer des charges dévastatrices et tenir le front pour un temps limité. Le fléau de guerre, leur arme de prédilection, est capable d’anéantir les meilleures défenses, mais c’est encore leur apparence terrifiante qui constitue leur meilleur atout.",2021-S02
11006,Piquiers de Fort Terreur,Pique d'Empalement,,,,"Entraînés à semer la peur et la panique dans les rangs ennemis, les Piquiers de la Maison Bolton sont dénués de tout sens moral. Leurs heaumes et leurs boucliers sont garnis de pointes afin de renforcer leur aspect terrifiant. Ils sont passés maîtres dans l’art d’infliger des blessures douloureuses, mais non fatales, à leurs adversaires, afin qu’une fois la bataille achevée, les nombreux prisonniers puissent permettre aux bourreaux de la Maison Bolton de s’adonner à leurs plaisirs sadiques.",2021