Id,Translated Name,Attack 1,Attack 2,Requirement,Quote,Lore,Version
10310,Ours,Mutilation Sauvage,,*Cette figurine n’est utilisée qu’avec la Capacité Lien du Change-peau.*,,"Les Change-peaux sont des hommes et des femmes capables de pénétrer dans l’esprit des animaux et de manipuler leurs actions, que ce soit de façon subtile ou ostentatoire. En temps de guerre, ce n’est pas le Change-peau lui-même que l’on remarque sur le champ de bataille, mais les bêtes qu’il contrôle, tels que les énormes ours Nordiens, les loups, les lynx-de-fumée, les hiboux et les aigles. Si ses animaux peuvent être tués, il est rare qu’un Change-peau soit vaincu longtemps, car le Nord ne manque pas de créatures féroces et redoutables.",2021
10311,Élu du Seigneur des Os,Armes en Os,,*Ne peut être recruté que dans une armée qui comprend Clinquefrac. Il doit être attaché à cette unité.*,,"Seuls les plus forts et les plus sauvages parmi les disciples des Os peuvent devenir un Élu du Seigneur des Os. Chaque Élu prend la place de son prédécesseur en le tuant au cours d’un combat rituel. L’armure du nouvel Élu est assemblée à partir des ossements du vaincu et complétée avec des os d’animaux afin d’offrir une meilleure protection. De prime abord, les Élus peuvent sembler n’être que de vulgaires sauvages, mais les vétérans de la Garde de Nuit enseignent aux frères novices de ne sous-estimer ni leur incroyable ruse, ni leurs extraordinaires talents martiaux.",2021-S03
10312,Mammouth de Guerre,Saccage,,Limité : *Votre armée peut inclure un maximum de 2 Mammouths de Guerre.*,,"Sur le champ de bataille, voir un Mammouth de Guerre foncer sur les positions ennemies constitue un spectacle impressionnant. Sa force incroyable et sa peau épaisse le rendent difficile à neutraliser. Il arrive que des géants chevauchent ces pachydermes, mais il ne reste plus assez de Mammouths dans le monde pour former de véritables corps de cavalerie. Ceux qui combattent aux ordres de leur maîtres sont cependant bien entraînés. Même si cela reste un événement rare, un Mammouth paniqué peut s’en prendre aussi bien à ses alliés qu’à ses ennemis.",2021-S01
10313,Mag Le Puissant,Fureur du Chef,,,,"Le Titre de Mag le Puissant reste, somme toute, relativement modeste. En tant que chef des géants, il a mené maintes fois son peuple à la victoire grâce à sa force redoutable. Même les troupes les plus lourdement protégées ne font pas le poids face à sa puissance, et ses qualités de chef (pour autant que les géants en possèdent) inspirent les siens au coeur de la bataille. Mag a largement les moyens de se jeter dans la mêlée, mais il doit toutefois rester prudent. Bien que difficiles à abattre, les géants ne sont pas immortels.",2021-S02
10314,Mag Le Puissant,Fureur du Chef,,,,"Le Titre de Mag le Puissant reste, somme toute, relativement modeste. En tant que chef des géants, il a mené maintes fois son peuple à la victoire grâce à sa force redoutable. Même les troupes les plus lourdement protégées ne font pas le poids face à sa puissance, et ses qualités de chef (pour autant que les géants en possèdent) inspirent les siens au coeur de la bataille. Mag a largement les moyens de se jeter dans la mêlée, mais il doit toutefois rester prudent. Bien que difficiles à abattre, les géants ne sont pas immortels.",2021
10315,Oursières de la Grève Glacée,Lancer de Pique,Piques et Lacérations,,,"Dans les terres lointaines qui s’étendent au-delà du Mur vivent les ours blancs les plus imposants de leur espèce, aussi grands que deux hommes quand ils se redressent, et capables de déchiqueter la roche comme l’acier. Seuls les sauvageons oseraient dompter de telles bêtes et les monter au combat. Les Oursières de la Grève Glacée sont peut-être plus lentes et plus lourdes que la cavalerie traditionnelle, mais là où un cheval ne peut que piétiner un ennemi, les Ours des Neiges peuvent mordre, déchiqueter et lacérer. Même en armure de plate complète, un homme ne fait pas le poids face à un ours.",S04
10316,Le Sanglier de Borroq,Festin Macabre,,*Ne peut être recruté que dans une armée qui comprend Borroq.*,,"Le fidèle sanglier de Borroq se tient toujours aux côtés de son maître. Cet animal porcin, aussi massif qu’un taureau adulte, est doté de défenses aussi longues que le bras d’un homme. Sa peau épaisse lui fournit une armure naturelle qui le protège des lames les plus tranchantes. Au combat, il empale ses adversaires et les envoie valdinguer d’un puissant coup de tête, pour ensuite se livrer à un macabre festin. Cependant, si Borroq quitte le champ de bataille, le sanglier fera de même.",S04
10317,"Varamyr Sixpeaux, Maître Change-Peau",Mutilation Sauvage,,,"« Et moi, je peux survoler le Mur et voir avec des yeux d’aigle. »","Comptant parmi les plus puissants Changes- Peaux au-delà du Mur, Varamyr Sixpeaux peut se lier simultanément à un énorme ours des neiges, trois loups, un lynx-de-fumée et un aigle. Au combat, il chevauche son grand ours des neiges depuis lequel il commande et coordonne les attaques de ses différents animaux. Rien n’échappe au regard de son aigle, ni à la traque implacable de son lynx-de-fumée. Quiconque tente de s’approcher de lui s’expose à être sauvagement agressé. Même s’il est possible de terrasser chacune de ses créatures individuellement, rien n’empêchera Varamyr d’en invoquer d’autres.",2021-S03
10318,"Varamyr Sixpeaux, Maître Change-Peau",Mutilation Sauvage,,,"« Et moi, je peux survoler le Mur et voir avec des yeux d’aigle. »","Comptant parmi les plus puissants Changes- Peaux au-delà du Mur, Varamyr Sixpeaux peut se lier simultanément à un énorme ours des neiges, trois loups, un lynx-de-fumée et un aigle. Au combat, il chevauche son grand ours des neiges depuis lequel il commande et coordonne les attaques de ses différents animaux. Rien n’échappe au regard de son aigle, ni à la traque implacable de son lynx-de-fumée. Quiconque tente de s’approcher de lui s’expose à être sauvagement agressé. Même s’il est possible de terrasser chacune de ses créatures individuellement, rien n’empêchera Varamyr d’en invoquer d’autres.",S04
10319,Lynx-de-Fumée,Coup de Griffes,,*Ne peut être recruté que dans une armée qui comprend Varamyr Sixpeaux.*,,"Même si un lynx-de-fumée seul ne représente pas un grand danger pour une unité d’hommes en armure, celui-ci est animé de la ruse de Varamyr Sixpeaux. En soutien des forces du Peuple Libre et oeuvrant en bande avec les autres animaux, le Lynx-de-Fumée de Varamyr constitue une menace aussi redoutable qu’insaisissable. Même lorsque Sixpeaux ne contrôle plus son gracieux félin, son Lynx-de-Fumée demeure un prédateur redoutable presqu’aussi gros homme. Investi de l’esprit de Sixpeaux, il devient une arme mortelle.",2021
10320,Meute de Loups,Tactiques de Meute,,*Ne peut être recruté que dans une armée qui comprend Varamyr Sixpeaux.*,,"Bien qu’inadaptés à tenir le front d’une bataille rangée, les loups contrôlés par Varamyr Sixpeaux sont excellents pour harceler les flancs et semer la panique parmi les archers et les machines de guerre à l’écart de la ligne de front. Ils ne semblent être que de simples loups, mais lorsqu’ils sont animés par l’esprit de leur maître, ils ne forment plus qu’un, une véritable meute capable de coordonner ses tactiques avec celles des combattants humains du Peuple Libre. Faut-il encore se demander pourquoi les change-peaux sont craints à ce point ?",2021
10321,Chasseurs de La Grève Glacée,Harpon,Harpon,,,"Les hommes du Clan du Morse maîtrisent l’art de la chasse qu’ils pratiquent dans les lointaines étendues glacées qui s’étendent au-delà du Mur. Désormais à la recherche d’un climat plus doux et de pâturages plus verts, ils descendent vers le sud en mettant leur expertise au service du Peuple Libre. Leurs robustes harpons sont capables d’embrocher aussi bien les soldats ennemis que les bêtes les plus sauvages. Leur habileté à maintenir leurs proies sous pression, couplée à une très grande mobilité, leur permet de surprendre l’ennemi en l’attaquant là où il s’y attend le moins.",S04
10322,Géants Lanceurs d’Épieux,Épieu de Géant,Épieu de Géant,,,"Qu’il y a-t-il de pire dans une bataille que de devoir affronter des géants ? Se retrouver face à des géants qui lancent des épieux de la taille d’un tronc d’arbre. Grâce à son alliance avec les géants, le Peuple Libre peut désormais aligner leurs Lanceurs d’Épieux, une véritable artillerie sur pattes. Leurs armes sont certes rudimentaires, mais une hampe de bois aussi épaisse que le torse d’un homme ne requiert guère de finesse. Toutefois, ces géants peuvent rapidement se retrouver débordés au corps à corps et doivent donc être protégés.",S04
10401,Coupe-Jarrets de la Maison Bolton,Aggression Impitoyable,,,,"Malgré leur équipement léger, les Coupe-Jarrets de la Maison Bolton jouissent d’une réputation de brutalité et d’efficacité impitoyable qui leur permet de répandre la peur dans les rangs de troupes ennemies bien mieux équipées. Leurs masses à pointes peuvent broyer leurs ennemis, mais c’est en tant qu’instruments de terreur qu’elles se révèlent les plus utiles. Les Coupe-Jarrets de la Maison Bolton se plaisent à humilier leurs ennemis vaincus ou, pire encore, à les capturer pour leur faire subir un sort plus terrible encore",2021-S01
10402,Filles du Bâtard de la Maison Bolton,Arc de Pisteur,Lames et Crocs,,,"Dressées à acculer et à abattre la plus lourde des infanteries, les Filles du Bâtard excellent dans les attaques de flanc et dans la traque d’adversaires en fuite. Bien qu’elles ne soient pas assez protégées pour soutenir un assaut prolongé, elles se complaisent à fondre sur les ennemis blessés par les flèches de leurs maîtres. Une forte récompense attend le dresseur qui aura su capturer un officier ennemi afin que Ramsay Bolton puisse « se divertir » après la bataille.",2021
10403,Écorchés de la Maison Bolton,Fléau de Guerre,,,,"Dans la Guerre des Cinq Rois, ceux que l’on nomme les Écorchés forment les rangs d’une cavalerie plus lourde que la plupart de celles combattant sous des bannières pourtant plus prestigieuses. Équipés de robustes armures d’acier (noirci, bien évidemment), de grands boucliers et de lourdes bardes pour leurs chevaux, les Écorchés peuvent effectuer des charges dévastatrices et tenir le front pour un temps limité. Le fléau de guerre, leur arme de prédilection, est capable d’anéantir les meilleures défenses, mais c’est encore leur apparence terrifiante qui constitue leur meilleur atout.",2021-S02
10404,Gardes Noirs de la Maison Bolton,Fléau à Pointes,,,,Tous les adversaires des Gardes Noirs de la Maison Bolton ont eu vent de leur cruauté. Leurs terribles fléaux à pointes peuvent défoncer les boucliers les plus solides. Les Gardes Noirs constituent les troupes les plus lourdes des forces de la Maison Bolton et sont donc capables de prendre et de tenir n’importe quelle position sur le champ de bataille.,2021
10405,Tirailleurs des Pitres Sanglants,Lame de Pitre,,,,"En dépit de leur apparence outrancière, les Pitres Sanglants forment une redoutable compagnie de mercenaires dont la cruauté est réputée excessive, y compris parmi les mercenaires les moins recommandables. Leur seule loyauté va à l’argent, mais si vous y mettez le prix, ils seront capables d’occuper n’importe quelle position dans votre armée. Les Tirailleurs portent des armes et des armures légères, ce qui leur donne la mobilité nécessaire pour se livrer à des attaques rapides sur les flancs, mais ils devront toutefois être mis à l’abri des charges directes.",S04
10406,Mercenaires Corbeaux Tornade,Épée Longue,,Réactivité : *Réduisez le coût de 1 Attachement de cette unité de 1.*,,"Bien que les Corbeaux Tornade ne soient pas toujours loyaux envers leurs chefs, leurs employeurs, voire envers eux-mêmes, leur dévouement absolu à l’argent est indiscutable. Lorsqu’on y met le prix, les Mercenaires Corbeaux Tornade se révèlent être une infanterie moyenne efficace, et sont capables de tenir une aile ou d’effectuer eux-mêmes des manœuvres de flanc. Tant que l’argent coule à flots, leur employeur, quel qu’il soit, peut compter sur leur professionnalisme sans faille.",S04
10407,Archers Corbeaux Tornade,Arc Long de Mercenaire,Épée Courte,,,"Que ce soit avec une lame, un arc ou les deux, un Corbeau Tornade reste un Corbeau Tornade. Il n’est motivé que par l’argent et une petite rallonge peut suffire à lui faire accomplir des miracles. Avec leurs arcs longs recourbés et leurs flèches à longue portée, les Archers Corbeaux Tornade sont des spécialistes du combat à distance. Ils ne brillent pas au corps à corps, même si leurs épées courtes peuvent occasionnellement leur permettre de repousser un assaillant affaibli. Un général avisé saura les tenir éloignés de la cavalerie ou de troupes débordant par le flanc.",S04
10408,Chevaucheurs de Zébrules des Pitres Sanglants,Armement Disparate,,,,"Montée à dos de Zébrule, la cavalerie des Pitres Sanglants fait preuve d’un flair insolent. Leurs montures pour le moins inhabituelles, originaires d’Essos, sont issues du croisement d’équidés rayés et de chevaux. Les Zébrules sont capables de survivre de très longues périodes avec très peu d’eau et de nourriture et ils se montrent tout aussi vifs que leurs homologues occidentaux. Dans les rangs des Pitres Sanglants, les Chevaucheurs de Zébrules font office de cavalerie légère, débordant par les flancs pour charger les unités bloquées et les archers exposés.",2021-S03
10409,Derviches Corbeaux Tornade,Frappe Éclair,,,,"Payez à un Derviche Corbeau Tornade une semaine de solde, et vous aurez à votre disposition tirailleur aguerri et endurci, apte à se déplacer rapidement en armure moyenne afin de frapper les positions ennemies les plus exposées. Les Corbeaux Tornade sont connus pour n’être fidèles qu’à l’argent et cette sinistre réputation s’étend jusqu’à leurs soldats les mieux entraînés. Pourtant, les employeurs qui voient les derviches en action ont rarement des raisons de se plaindre, car ces guerriers redoutables sont capables de mettre en pièces les flancs ennemis avant de se replier en toute sécurité, annihilant toute velléité de contre-attaque.",S04
10410,Chevaliers Errants,Lame de Chevalier,,,,"Les Chevaliers Errants parcourent le monde à la recherche d’un emploi. Ces nobles sans terre, qui n’ont pour seuls biens que leurs armes, leur armure et leur destrier, sont souvent rejetés et méprisés par leurs pairs, mis à part en temps de guerre. Quel que soit leur camp dans la Guerre des Cinq Rois, les nobles trouvent toujours une utilité à un groupe d’une demi-douzaine de chevaliers mercenaires, bien entraînés et déjà équipés. Néanmoins, leur équipement est rarement à la hauteur de celui des véritables chevaliers.",2021
10411,Maîtres d'Armes de la Compagnie Dorée,Frappe Tactique,,,,"La Compagnie Dorée est bien connue pour sa devise, « Notre parole vaut de l’or ». Celui qui les engage sait pertinemment qu’une fois sur le champ de bataille, ils savent rendre la monnaie de leur pièce. Les Maîtres d’Armes de la Compagnie Dorée ont reçu un entraînement intensif, et sont experts dans l’art d’exploiter tout point faible de la défense adverse. Ils sont réputés pour ne jamais reculer, même lorsqu’ils sont confrontés à des situations désespérées. Louer les services des Maîtres d’Armes est un investissement sûr pour celui dont les coffres sont suffisamment remplis.",S04
10412,Arbalétriers de la Compagnie Dorée,Arbalète,Épée Courte,,,"La Compagnie Dorée, le groupe de mercenaires le plus fiable des Citées Libres, propose les services de plusieurs troupes de combat. Les Arbalétriers sont l’une d’entre elles. D’une résolution sans faille, ces tireurs émérites attendent patiemment que l’ennemi se rapproche pour faire pleuvoir leur déluge de mort. Leurs carreaux transpercent les armures avec aisance, notamment à courte portée. Quiconque cherche à renforcer ses troupes fera une bonne affaire en les engageant.",2021-S02
10413,Éléphant de Guerre de la Compagnie Dorée,Écrasement,,*Votre armée ne peut inclure qu’un seul Éléphant de Guerre pour chaque unité d’Infanterie de la Compagnie Dorée.*,,"Face à la charge de ces gigantesques mastodontes, même les soldats les plus aguerris se retrouvent démunis. Les Éléphants de Guerre de la Compagnie Dorée sont capables d’enfoncer n’importe quelle ligne ennemie avec une brutalité sans égale. Ils semblent invulnérables lorsqu’ils piétinent sauvagement leurs adversaires ou qu’ils les fauchent de leurs défenses. Toutefois, ce ne sont que des animaux et, sans leur dresseur à proximité, ils s’arrêtent parfois en plein élan, désemparés.",2021-S03
10414,Épées Louées de Lys,Lames de Pirate,,,,"Sur les îles-forteresses de Lys, les hautes murailles et les incessantes patrouilles d’Épées Louées suffisent à dissuader tout éventuel attaquant. Les Épées louées ne sont toutefois rien d’autre que des pirates qui offrent leurs services au plus offrant. La gloire ne les intéresse pas. Ils ne sont motivés que par le pillage et le paiement de leur solde une fois de retour à leur port d’attache.",S04
10415,Freux,Armes de Récupération,,,,"Si l’on excepte leur étonnante loyauté, les Freux de Tyrion Lannister ne sont guère différents des autres tribus montagnardes et des pillards ordinaires. Bien qu’ils soient plus attachés à la fortune de Tyrion qu’à sa propre personne, ils ont su rester fidèles, même lorsque la trahison aurait constitué une option plus lucrative. En tant que mercenaires, ces troupes se révèlent tout à fait rentables si elles sont employées en tant qu’éclaireurs ou pour harceler les flancs ennemis. Leur équipement léger ne leur permet pas de soutenir un engagement prolongé en première ligne.",2021
10501,Vétérans de la Garde,Armes Doubles,,,,"Bien que l’on puisse compter sur les Frères Jurés pour tenir une position, les Vétérans possèdent l’armement et l’expertise nécessaires pour faire progresser le front. Ce sont des combattants aguerris, quasiment impossibles à mettre en déroute et dotés du meilleur équipement que les Constructeurs peuvent forger. Même les soldats les plus chevronnés des Sept Royaumes auraient du mal à les arrêter, et encore plus à les vaincre.",2021-S03
10502,Frères Jurés,Espadon,,,,"Les Frères Jurés sont les piliers de la Garde de Nuit, affrontant les Sauvageons et les horreurs Nordiennes avec une maîtrise et un stoïcisme résultant d’un long entraînement. Solidement armés grâce à leurs propres forges, les Frères Jurés disposent d’un meilleur équipement que la plupart des soldats des autres grandes Maisons (à l’exception de ceux de la Maison Lannister, bien évidemment). Lorsqu’il s’agit de tenir une position, même si la situation semble désespérée, vous pouvez compter sur les Frères Jurés.",2021
10503,Patrouilleurs Pisteurs,Arc Courbe,Épée Courte,,,"Les Patrouilleurs de la Garde de Nuit comportent de nombreuses unités aux compétences différentes, mais ce sont les Pisteurs qui personnifient le mieux leur capacité de perception. Cavaliers éclaireurs au dévouement sans faille, les Pisteurs sont chargés de fournir des renseignements sur l’ennemi en évaluant sa force, son nombre et sa position. Sur le champ de bataille, leur rôle consiste également à débusquer les adversaires les plus vulnérables. Un général avisé saura tenir compte de leurs conseils afin d’exploiter au mieux les faiblesses de l’adversaire.",2021-S03
10504,Fantôme,Griffes et Crocs,,*Ne peut être recruté que dans une armée qui comprend Jon Snow.*,,"Tapi dans le sillage de Jon Snow telle une ombre menaçante, le loup-garou albinos appelé Fantôme n’aurait pu être plus justement nommé. Sur le champ de bataille, Fantôme évolue plus ou moins librement, grâce à sa compréhension instinctive de la volonté de son maître. Pouvant atteindre des pointes de vitesse ahurissantes, Fantôme est aussi capable de déchirer une armure de ses puissantes mâchoires. Il se révèle particulièrement utile pour les attaques de flanc ou pour poursuivre les troupes en déroute. En effet, se faire charger par un loup-garou a de quoi glacer le sang de bien des hommes.",2021
10505,Patrouilleurs Chasseurs,Arc de Chasseur,Frappe Éclair,,,"Œuvrant souvent de concert avec les Pisteurs, les Patrouilleurs Chasseurs sont passés maîtres dans l’élimination de cibles-clés. Si la furtivité est rarement de mise lors d’une bataille ouverte, ils peuvent cependant frapper rapidement et éliminer les adversaires affaiblis ou vulnérables sans leur laisser une chance de répliquer. Un bon général prendra soin d’éviter qu’ils soient coincés au corps à corps, une situation délicate pour la plupart des unités d’infanterie légère.",2021-S03
10506,Scorpion et Équipe de Constructeurs,Baliste,Armes de l'Équipage,Limité : *Votre armée ne peut pas contenir plus de 2 Scorpions et Équipage de Constructeurs.*,,"Les Constructeurs de la Garde de Nuit sont réputés pour leur ingéniosité et le Scorpion en est la parfaite illustration. Les Constructeurs sont capables d’assembler cet engin mobile à l’aide de quelques pièces mécaniques et du bois à leur disposition. Le Scorpion tire d’immenses carreaux à longue portée tout en conservant une grande précision. Un seul projectile peut balayer des rangs entiers. Toutefois, le Scorpion est peu maniable et le mettre en position requiert du temps.",S04
10507,Mangonneau des Constructeurs,Tir de Rocher,Armes de l'Équipage,Limité : *Votre armée ne peut pas contenir plus de 2 Mangonneaux des Constructeurs.*,,"Les équipages de Constructeurs sont versés dans l’art de fabriquer des Mangonneaux mobiles et de les utiliser sur le champ de bataille. Ils insistent sur le fait que ces engins ne sont pas des catapultes, bien que les principes de base des deux engins soient similaires. Les catapultes sont déployées lors de conflits plus importants et nécessitent généralement des munitions spéciales. La précision mortelle des Mangonneaux permet à un équipage compétent de faire pleuvoir sur les formations ennemies des projectiles contre lesquels même l’infanterie la plus lourde est sans défense.",S04
10508,Arbalétriers Constructeurs,Arbalète,Épée Courte,,,"Même si la tâche principale des Constructeurs demeure la maintenance du Mur et de ses fortifications, ils sont également responsables de l’équipement de toute la Garde de Nuit. Ils ne sont donc généralement pas placés en première ligne sur le champ de bataille. Mais face à certains ennemis, il est bon que chaque homme ait une arme sous la main. L’entretien des arbalètes étant plus délicat que celui de la plupart des armes, il était logique d’en équiper les Constructeurs et d’utiliser ces derniers en tant qu’appui au feu de deuxième ligne.",2021-S01
10509,Recrues,Armes Simples,,,,"Généralement dépenaillées et souvent indisciplinées, les Recrues de la Garde de Nuit sont la lie de tout Westeros. Bien que la Garde ait pour habitude d’entraîner ses recrues avant de les envoyer au front, il peut arriver que chaque homme valide soit appelé à défendre le Mur. Contre un adversaire de taille, un général avisé saura ne pas trop se reposer sur les Recrues, susceptibles d’être mises en déroute au premier signe de résistance.",2021-S01
10510,Maréchal de la Garde,Épée Longue,,Limité : *Votre armée ne peut pas contenir plus de 2 Maréchaux de la Garde.*,,"Pour accéder au grade de Maréchal de la Garde, il faut plus que de simples talents de cavalier et de meneur d’hommes. Le Frère Juré doit avoir servi en première ligne et avoir participé à de longues patrouilles au-delà du Mur pendant suffisamment longtemps pour connaître tous les ennemis potentiels de la Garde et savoir comment les affronter avec efficacité et détermination. Les Maréchaux de la Garde savent tirer le meilleur parti de leurs troupes, en exploitant au mieux leur potentiel offensif et leur mobilité.",S04
10511,"Mains-Froides, Allié Mystérieux",Épée Longue,,*Ne peut pas être recruté dans une armée qui contient Benjen Stark.*,,"Allié un jour, ennemi le lendemain, l’être connu sous le nom de Mains-Froides est un spectre mystérieux aux motivations inconnues qui peut aussi bien soutenir les troupes que les harceler. Les nuées de corbeaux qu’il commande fondent sur ses adversaires, les noyant dans une mer d’ailes battantes et de griffes acérées. Au combat, il monte un gigantesque orignac et fait preuve d’une formidable prouesse martiale. Il porte l’armure et le manteau noir des frères de la Garde de Nuit, bien que nul ne puisse affirmer s’il s’agit des siens ou s’ils ont été pris sur la dépouille d’un ennemi. Lorsqu’il a été vaincu, Mains-Froides réapparaît peu après sur le champ de bataille.",S04
